03-corporate-finance/03-5-damodaran-online/03-5-4-tools/amccapstru/amccapstru-country-erp.csv

Mature Market ERP +,0.046,"Updated January 1, 2024"
Changing this number will update all your country equity risk premiums.,,
Country,Moody's rating,Adj. Default Spread
Abu Dhabi,Aa2,0.005377876270766179
Albania,B1,0.04904110980246301
Algeria,NR,0.04904110980246301
Andorra (Principality of),Baa2,0.020743237044383835
Angola,B3,0.07080870423175468
Anguilla,NR,0.1054310997313879
Antigua & Barbuda,NR,0.1054310997313879
Argentina,Ca,0.13073361124886354
Armenia,Ba3,0.03918166997272502
Aruba,Baa2,0.020743237044383835
Australia,Aaa,0
Austria,Aa1,0.004353518885858335
Azerbaijan,Ba1,0.027273515373171343
Bahamas,B1,0.04904110980246301
Bahrain,B2,0.059924907017108855
Bangladesh,B1,0.04904110980246301
Barbados,B3,0.07080870423175468
Belarus,C,0.175
Belgium,Aa3,0.006530278328787503
Belize,Caa2,0.09808221960492602
Benin,B1,0.04904110980246301
Bermuda,A2,0.009219216464170593
Bolivia,Caa1,0.08169250144640053
Bosnia and Herzegovina,B3,0.07080870423175468
Botswana,A3,0.013060556657575006
Brazil,Ba2,0.032779436317051
British Virgin Islands,Ba2,0.032779436317051
Brunei,NR,0.006530278328787503
Bulgaria,Baa1,0.01741407554343334
Burkina Faso,Caa1,0.08169250144640053
Cambodia,B2,0.059924907017108855
Cameroon,Caa1,0.08169250144640053
Canada,Aaa,0
Cape Verde,B3,0.07080870423175468
Cayman Islands,Aa3,0.006530278328787503
Channel Islands,NR,0.009588220147283357
Chile,A2,0.009219216464170593
China,A1,0.007682680386808828
Colombia,Baa2,0.020743237044383835
Congo (Democratic Republic of),B3,0.07080870423175468
Congo (Republic of),Caa2,0.09808221960492602
Cook Islands,B1,0.04904110980246301
Costa Rica,B1,0.04904110980246301
Croatia,Baa2,0.020743237044383835
Cuba,Ca,0.13073361124886354
Curaçao,Baa2,0.020743237044383835
Cyprus,Baa2,0.020743237044383835
Czech Republic,Aa3,0.006530278328787503
Denmark,Aaa,0
Dominican Republic,Ba3,0.03918166997272502
Ecuador,Caa3,0.10896601681957188
Egypt,Caa1,0.08169250144640053
El Salvador,Caa3,0.10896601681957188
Estonia,A1,0.007682680386808828
Ethiopia,Caa2,0.09808221960492602
Falkland Islands,NR,0.04291508619362226
Fiji,B1,0.04904110980246301
Finland,Aa1,0.004353518885858335
France,Aa2,0.005377876270766179
French Guiana,NR,0.04291508619362226
Gabon,Caa1,0.08169250144640053
Gambia,NR,0.04904110980246301
Georgia,Ba2,0.032779436317051
Germany,Aaa,0
Ghana,Caa3,0.10896601681957188
Gibraltar,NR,0.009588220147283357
Greece,Ba1,0.027273515373171343
Greenland,NR,0
Guatemala,Ba1,0.027273515373171343
Guernsey (States of),A1,0.007682680386808828
Guinea,NR,0.09808221960492602
Guinea-Bissau,NR,0.05992490701710884
Guyana,NR,0.017414075543433345
Haiti,NR,0.10896601681957191
Honduras,B1,0.04904110980246301
Hong Kong,Aa3,0.006530278328787503
Hungary,Baa2,0.020743237044383835
Iceland,A2,0.009219216464170593
India,Baa3,0.023944353872220846
Indonesia,Baa2,0.020743237044383835
Iran,NR,0.07080870423175468
Iraq,Caa1,0.08169250144640053
Ireland,Aa3,0.006530278328787503
Isle of Man,Aa3,0.006530278328787503
Israel,A1,0.007682680386808828
Italy,Baa3,0.023944353872220846
Ivory Coast,Ba3,0.03918166997272502
Jamaica,B1,0.04904110980246301
Japan,A1,0.007682680386808828
Jersey (States of),Aa3,0.006530278328787503
Jordan,B1,0.04904110980246301
Kazakhstan,Baa2,0.020743237044383835
Kenya,B3,0.07080870423175468
"Korea, D.P.R.",NR,0.175
Kuwait,A1,0.007682680386808828
Kyrgyzstan,B3,0.07080870423175468
Laos,Caa3,0.10896601681957188
Latvia,A3,0.013060556657575006
Lebanon,C,0.175
Liberia,NR,0.13073361124886354
Libya,NR,0.020743237044383835
Liechtenstein,Aaa,0
Lithuania,A2,0.009219216464170593
Luxembourg,Aaa,0
Macau,Aa3,0.006530278328787503
Macedonia,Ba3,0.03918166997272502
Madagascar,NR,0.07080870423175468
Malawi,NR,0.13073361124886354
Malaysia,A3,0.013060556657575006
Maldives,Caa1,0.08169250144640053
Mali,Caa2,0.09808221960492602
Malta,A2,0.009219216464170593
Martinique,NR,0
Mauritius,Baa3,0.023944353872220846
Mexico,Baa2,0.020743237044383835
Monaco,NR,0.009588220147283357
Moldova,B3,0.07080870423175468
Mongolia,B3,0.07080870423175468
Montenegro,B1,0.04904110980246301
Montserrat,Baa3,0.023944353872220846
Morocco,Ba1,0.027273515373171343
Mozambique,Caa2,0.09808221960492602
Myanmar,NR,0.10896601681957191
Namibia,B1,0.04904110980246301
Netherlands,Aaa,0
Netherlands Antilles,NR,0.1054310997313879
New Zealand,Aaa,0
Nicaragua,B3,0.07080870423175468
Niger,Caa2,0.09808221960492602
Nigeria,Caa1,0.08169250144640053
Norway,Aaa,0
Oman,Ba1,0.027273515373171343
Pakistan,Caa3,0.10896601681957188
Palestinian Authority,NR,0.016082653627874467
Panama,Baa2,0.020743237044383835
Papua New Guinea,B2,0.059924907017108855
Paraguay,Ba1,0.027273515373171343
Peru,Baa1,0.01741407554343334
Philippines,Baa2,0.020743237044383835
Poland,A2,0.009219216464170593
Portugal,A3,0.013060556657575006
Qatar,Aa3,0.006530278328787503
Ras Al Khaimah (Emirate of),A3,0.013060556657575006
Reunion,NR,0.012518555898193178
Romania,Baa3,0.023944353872220846
Russia,NR,0.04904110980246301
Rwanda,B2,0.059924907017108855
Saint Lucia,NR,0.1054310997313879
Saudi Arabia,A1,0.007682680386808828
Senegal,Ba3,0.03918166997272502
Serbia,Ba2,0.032779436317051
Sharjah,Ba1,0.027273515373171343
Sierra Leone,NR,0.10896601681957191
Singapore,Aaa,0
Slovakia,A2,0.009219216464170593
Slovenia,A3,0.013060556657575006
Solomon Islands,Caa1,0.08169250144640053
Somalia,NR,0.13073361124886354
South Africa,Ba2,0.032779436317051
South Korea,Aa2,0.005377876270766179
Spain,Baa1,0.01741407554343334
Sri Lanka,Ca,0.13073361124886354
St. Maarten,Ba2,0.032779436317051
St. Vincent & the Grenadines,B3,0.07080870423175468
Sudan,NR,0.175
Suriname,Caa3,0.10896601681957188
Swaziland,B3,0.07080870423175468
Sweden,Aaa,0
Switzerland,Aaa,0
Syria,NR,0.175
Taiwan,Aa3,0.006530278328787503
Tajikistan,B3,0.07080870423175468
Tanzania,B2,0.059924907017108855
Thailand,Baa1,0.01741407554343334
Togo,B3,0.07080870423175468
Trinidad &' Tobago,Ba2,0.032779436317051
Tunisia,Caa2,0.09808221960492602
Turkey,B3,0.07080870423175468
Turks & Caicos Islands,Baa1,0.01741407554343334
Uganda,B2,0.059924907017108855
Ukraine,Ca,0.13073361124886354
United Arab Emirates,Aa2,0.005377876270766179
United Kingdom,Aa3,0.006530278328787503
United States,Aaa,0
Uruguay,Baa2,0.020743237044383835
Uzbekistan,Ba3,0.03918166997272502
Venezuela,C,0.175
Vietnam,Ba2,0.032779436317051
Yemen,NR,0.10896601681957191
Zambia,Caa3,0.10896601681957188
Zimbabwe,NR,0.09808221960492602
Region,ERP,Default Spread
Africa,0.13763852306889546,0.06826267935109193
Asia,0.06280540500857856,0.012518555898193178
Australia & New Zealand,0.046047923618641934,3.5698901544265913e-05
Caribbean,0.1875348819700155,0.1054310997313879
Central and South America,0.10361091058162494,0.04291508619362226
Eastern Europe & Russia,0.09657938347719226,0.037670398345457844
Middle East,0.06758999089248985,0.016082653627874467
North America,0.046,0
Western Europe,0.058871606293643367,0.009588220147283357
Global,0.0641,0.0135

03-corporate-finance/03-5-damodaran-online/03-5-3-papers/valpacket1spr24.md

# The simplest way of estimating an additional country risk premium: The country default spread

- □ Default spread for country: In this approach, the country equity risk premium is set equal to the default spread for the country, estimated in one of three ways:
  - ■ The default spread on a dollar denominated bond issued by the country. (In January 2024, that spread was % for the Brazilian \$ bond) was 1.817%.
  - ■ The sovereign CDS spread for the country. In January 2024, the ten-year CDS spread for Brazil, adjusted for the US CDS, was 1.81%.
  - ■ The default spread based on the local currency rating for the country. Brazil's sovereign local currency rating is Ba2 and the default spread for a Ba2 rated sovereign was about 3.28% in January 2024.
- □ Add the default spread to a “mature” market premium: This default spread is added on to the mature market premium to arrive at the total equity risk premium for Brazil, assuming a mature market premium of 4.60%.
  - ■ Country Risk Premium for Brazil = 3.28%
  - ■ Total ERP for Brazil = 4.60% + 3.28% = 7.88%

# Why implied premiums matter?

- ¨ In many investment banks, it is common practice (especially in corporate finance departments) to use historical risk premiums (and arithmetic averages at that) as risk premiums to compute cost of equity. ¨ If all analysts in a group used the arithmetic average premium (for stocks over T.Bills) for 1928-2023 of 8.32% to value stocks in January 2022, given the implied premium of 4.60%, what are they likely to find?
  - a. The values they obtain will be too low (most stocks will look overvalued)
  - b. The values they obtain will be too high (most stocks will look under valued)
  - c. There should be no systematic bias as long as they use the same premium to value all stocks.

# An ERP for the Sensex

¨ Inputs for the computation ¤ Sensex on 9/5/07 = 15446 ¤ Dividend yield on index = 3.05% ¤ Expected growth rate - next 5 years = 14% ¤ Growth rate beyond year 5 = 6.76% (set equal to riskfree rate) ¨ Solving for the expected return:

## Are some analysts more equal than others?

¨ A study of All-America Analysts (chosen by Institutional Investor) found that ¤ There is no evidence that analysts who are chosen for the All-America Analyst team were chosen because they were better forecasters of earnings. (Their median forecast error in the quarter prior to being chosen was 30%; the median forecast error of other analysts was 28%) ¤ However, in the calendar year following being chosen as All-America analysts, these analysts become slightly better forecasters than their less fortunate brethren. (The median forecast error for All-America analysts is 2% lower than the median forecast error for other analysts) ¤ Earnings revisions made by All-America analysts tend to have a much greater impact on the stock price than revisions from other analysts ¤ The recommendations made by the All America analysts have a greater impact on stock prices (3% on buys; 4.7% on sells). For these recommendations the price changes are sustained, and they continue to rise in the following period (2.4% for buys; 13.8% for the sells).

## *The Status Quo*

Run by existing management, with conservative reinvestment policies (reinvestment rate = 14.34% and debt ratio = 10.4%.